{
  "schema_version": "1",
  "status": "partial",
  "restaurant": {
    "name": "Mandola’s Italian Kitchen",
    "city": "Cedar Park, TX",
    "address": "12100 W Parmer Ln Ste. 200, Cedar Park, TX 78613",
    "website": "https://mandolas.com/locations/cedar-park/"
  },
  "selection_rationale": "The official Mandola’s Cedar Park location page identifies the restaurant and branch at 12100 W Parmer Ln Ste. 200, Cedar Park, TX 78613, matching the requested city and the supplied search result. I will use only this Cedar Park branch’s official menu sources; menu URLs are linked from the verified location page.",
  "extracted_at": "2026-09-08T18:41:48Z",
  "menus": [
    {
      "name": "Texas Dining Menu",
      "availability": null,
      "notes": [
        "AGES 12 & UNDER ONLY applies to Children's Menu.",
        "Each children’s entrée includes a drink and a scoop of gelati; dine-in only. No free refills on milk.",
        "*Extra dressing available by request for additional charge.",
        "*Extra sauce available by request for additional charge.",
        "Sub gluten free crust: 4 for pizza; 3.5 for children’s pizza.",
        "Sub gluten free pasta: 3; children’s gluten free pasta: 1.5.",
        "Allergen Warning: Food prepared here may contain milk, eggs, wheat, soy, peanuts, tree nuts, fish, and shellfish.",
        "GS denotes a Gluten-Sensitive Menu Item. The restaurant is not a gluten-free environment.",
        "Vegetarian symbol: ⩔. Caution symbol ☩ indicates some food items may contain olive pits, bones, or shells.",
        "§ indicates dishes fried in oil that may contain shellfish and seafood.",
        "Consuming raw or undercooked meats, poultry, seafood, shellfish, or eggs may increase the risk of foodborne illness.",
        "Catering contact: 512.375.0153 | catering@mandolas.com"
      ],
      "sections": [
        {
          "name": "ANTIPASTI",
          "description": null,
          "items": [
            {
              "name": "FRIED MOZZARELLA",
              "description": "Coated with homemade breadcrumbs, served with marinara.",
              "prices": [
                {
                  "label": null,
                  "text": "11",
                  "amount": "11",
                  "currency": null
                }
              ],
              "option_groups": [],
              "dietary_labels": [],
              "allergens": [],
              "notes": [
                "§"
              ],
              "sources": [
                {
                  "source_id": "s2",
                  "page": null
                }
              ]
            },
            {
              "name": "CALAMARI & ZUCCHINI FRITTI",
              "description": "Coated & fried in seasoned flour & semolina, served with marinara.",
              "prices": [
                {
                  "label": null,
                  "text": "14",
                  "amount": "14",
                  "currency": null
                }
              ],
              "option_groups": [
                {
                  "name": "Add-on",
                  "min_selections": null,
                  "max_selections": null,
                  "options": [
                    {
                      "name": "Fried shrimp",
                      "description": "6 fried shrimp",
                      "prices": [
                        {
                          "label": "Add",
                          "text": "8",
                          "amount": "8",
                          "currency": null
                        }
                      ]
                    }
                  ]
                }
              ],
              "dietary_labels": [],
              "allergens": [],
              "notes": [],
              "sources": [
                {
                  "source_id": "s2",
                  "page": null
                }
              ]
            },
            {
              "name": "SAUSAGE & PEPPERS",
              "description": "Grilled Sicilian fennel sausage topped with peperonata.",
              "prices": [
                {
                  "label": null,
                  "text": "12",
                  "amount": "12",
                  "currency": null
                }
              ],
              "option_groups": [
                {
                  "name": "Add-on",
                  "min_selections": null,
                  "max_selections": null,
                  "options": [
                    {
                      "name": "Mozzarella",
                      "description": null,
                      "prices": [
                        {
                          "label": "Add",
                          "text": "1.5",
                          "amount": "1.5",
                          "currency": null
                        }
                      ]
                    }
                  ]
                }
              ],
              "dietary_labels": [
                "Gluten-Sensitive"
              ],
              "allergens": [],
              "notes": [],
              "sources": [
                {
                  "source_id": "s2",
                  "page": null
                }
              ]
            },
            {
              "name": "BRUSCHETTA alla CHECCA",
              "description": "Garlic bread with fresh diced tomatoes, garlic, basil, EVOO.",
              "prices": [
                {
                  "label": null,
                  "text": "10.5",
                  "amount": "10.5",
                  "currency": null
                }
              ],
              "option_groups": [
                {
                  "name": "Options",
                  "min_selections": null,
                  "max_selections": null,
                  "options": [
                    {
                      "name": "Mozzarella",
                      "description": null,
                      "prices": [
                        {
                          "label": "Add",
                          "text": "1.5",
                          "amount": "1.5",
                          "currency": null
                        }
                      ]
                    },
                    {
                      "name": "Gluten free bread",
                      "description": null,
                      "prices": [
                        {
                          "label": "Sub",
                          "text": "3.5",
                          "amount": "3.5",
                          "currency": null
                        }
                      ]
                    }
                  ]
                }
              ],
              "dietary_labels": [
                "Vegetarian"
              ],
              "allergens": [],
              "notes": [],
              "sources": [
                {
                  "source_id": "s2",
                  "page": null
                }
              ]
            },
            {
              "name": "GARLIC FRIES",
              "description": "Tossed with garlic, parsley, Romano cheese, served with creamy pesto dip.",
              "prices": [
                {
                  "label": null,
                  "text": "9.5",
                  "amount": "9.5",
                  "currency": null
                }
              ],
              "option_groups": [],
              "dietary_labels": [],
              "allergens": [],
              "notes": [
                "§"
              ],
              "sources": [
                {
                  "source_id": "s2",
                  "page": null
                }
              ]
            },
            {
              "name": "GARLIC BREAD",
              "description": "Toasted ciabatta with a mix of garlic butter, grated cheese, spices.",
              "prices": [
                {
                  "label": null,
                  "text": "6.5",
                  "amount": "6.5",
                  "currency": null
                }
              ],
              "option_groups": [
                {
                  "name": "Options",
                  "min_selections": null,
                  "max_selections": null,
                  "options": [
                    {
                      "name": "Gluten free bread",
                      "description": null,
                      "prices": [
                        {
                          "label": "Sub",
                          "text": "3.5",
                          "amount": "3.5",
                          "currency": null
                        }
                      ]
                    },
                    {
                      "name": "Mozzarella",
                      "description": null,
                      "prices": [
                        {
                          "label": "Add",
                          "text": "1.5",
                          "amount": "1.5",
                          "currency": null
                        }
                      ]
                    }
                  ]
                }
              ],
              "dietary_labels": [
                "Vegetarian"
              ],
              "allergens": [],
              "notes": [],
              "sources": [
                {
                  "source_id": "s2",
                  "page": null
                }
              ]
            }
          ]
        },
        {
          "name": "ZUPPA",
          "description": null,
          "items": [
            {
              "name": "MINESTRONE",
              "description": "Vegetarian soup with zucchini, kale, beans, cabbage, potatoes, tomatoes, green beans, carrots, celery, ditalini pasta.",
              "prices": [],
              "option_groups": [
                {
                  "name": "Size",
                  "min_selections": null,
                  "max_selections": null,